Writer,Title,Song
Khan Ataur Rahaman,এ খাঁচা ভাঙ্গব আমি কেমন করে,"এ খাঁচা ভাঙ্গব আমি কেমন করে।

দিকে দিকে বাজল যখন

শেকল ভাঙার গান

আমি তখন চোরের মত

হুজুর হুজুর করায় রত।

চাচা আপন বাঁচা বলে

বাঁচিয়েছি প্রাণ

আসলে ভাই একা একা

বাঁচার নামে আছি মরে

এ খাঁচা ভাঙ্গব আমি কেমন করে।।"
Khan Ataur Rahaman,শ্যামল বরণ মেয়েটি,"শ্যামল বরণ মেয়েটি

ডাগর কালো আঁখিটি

না না তার নাম বলব না

তোমরা তাকে দেখেছ

গল্প করে জেনেছ

শুধু তাহার নাম জান না

মিষ্টি তাহার সোনা মুখে হাসি ধরে না

এত বকা ঝকি তবু প্রাণ ভাঙে না।

এত করে বলেছি এত বারণ করেছি

বললে কারোর কথা শোনা না

এখানে এ দালান কোঠার ভীড়ে

কিংবা কোন গাঁয়ের কুঁড়ে ঘরে

তোমরা তাকে কত দেখেছ

শুধু নাম জান না

না না তার নাম বলব না।।

হায় রে সেই অভাগিনীর স্বপ্ন ছিল যত

তিলে তিলে নিভে হল পোড়াকূপের মত

আকাশ ভরা মিটিমিটি তারা জ্বলে যত

অভাগিনীর দুচোখ জুড়ে আশা ছিল তত

পথের পানে চেয়ে এবার

কেটে যাবে দিন

চোখের জলে গাঁথা মালা

ধূলায় হবে লীন

সকাল সাঝে কুড়িয়ে পাওয়া

ঝরা ফুলের মত

গানের মালায় গাঁথা হবে

তাহার কথা যত।

এখানে এ দালান কোঠার ভীড়ে

দেখেছি সে অভাগিনী কেঁদে কেঁদে ফিরে

সাগর সেঁচে খোঁজেনি সে হিরামতির মালা

কুঁড়ে ঘরে রাখবে কোথায় এত সুখের জ্বালা।

বসে ছিল খেয়ার আশে নদী হবে পার

ধূলোমাটির কড়ি কিছু আঁচল বাঁধা কার।

হায়রে কখন অথৈ জলে আঁচল গেল ছিঁড়ে

অভাগী তাই এপাড় ওপাড় কেঁদে কেঁদে ফেরে।

এখানে এ দালান কোঠার ভীড়ে

দেখেছি সে অভাগিনী কেঁদে কেঁদে ফিরে"
Khan Ataur Rahaman,তুমি চেয়েছিলে ওগো জানতে,"তুমি চেয়েছিলে ওগো জানতে

কেন এত ভাল লাগে তোমাকে

আমি বহুবার ভেবে দেখেছি

তার উত্তর কিছু জানি না।।

শুধু জানি তুমি আছ

তাই ভাল লাগে পৃথিবীকে

তুমি আজও ভালবাসো

তাই ভালবাসি জীবনকে

ওগো তোমায় ছাড়া এই পৃথিবীকে

এই জীবনকে চাই না

আমি আর কিছু জানি না

তুমি যখন ছিলে না

ওগো তখন সুখ ছিল না

তখন আমার কবিতার সাধনা

সুরের আরাধনা

বিফল বিভূমে হারাতো

সেই তুমি ফিরে এলে

তাই বেঁধে রাখি কবিতাকে

সেই আমি সেই তুমি

তাই সুরে বাঁধি বাঁশিটিকে

ওগো তোমায় ছাড়া এই কবিতাকে

এই বাঁশিটিকে চাই না

আমি আর কিছু জানি না।।"
Khan Ataur Rahaman,ও আমার চক্ষু নাই,"পথে পথে দিলাম ছড়াইয়ারে

সেই দুঃখে চোখেরও পানি

ও আমার চক্ষু নাই

পাড় নাই কিনার নাই রে

ও আমার চক্ষু নাই

ঘর নাই ও মোর জন নাই

তবু দিলাম ভাঙ্গা নায়ে

অথৈ সায়র পাড়ি

পথে পথে দিলাম ছড়াইয়ারে

সেই দুঃখে চোখেরও পানি

ও আমার বৈঠা নাই

ও আমার সুখ নাই

নিদ নাই চোখে নিদ নাই

বিধিরে তোমার খেয়ালের শেষ নাই

দয়া নাই তোমার মায়া নাই

তবু জনম দুঃখি আমি

তোমায় আপন জানি

পথে পথে দিলাম ছড়াইয়ারে

সেই দুঃখে চোখেরও পানি

ও আমার চক্ষু নাই"
Khan Ataur Rahaman,জীবন সে তো পদ্ম পাতায় শিশির বিন্দু,"জীবন সেতো পদ্ম পাতায় শিশির বিন্দু

মরুভুমির বুকে যেন বিষাদসিন্ধু

মনরে সে জীবন নিয়ে কেন এত কান্না

জীবনের পায়ে দিলি কেন এত ধর্ণা।।

আলোকের রূপ ধরে আলেয়া ছোটে

জোনাকির জ্বালা যেন ফুল হয়ে ফোটে

আহারে রাজার কুমার সোনার হরিণীতে মরে মাথা কুটে।

সোনার কাঠি রূপার যাদু আর নারে আর না।।

জলের লিখন যদি কপালের লেখা

প্রেমের আগুনে পুড়ে মরণে দেখা।

অবুঝ হিয়া তবু প্রেমের দোসর খুজে ফেরে হাটে হাটে।

ভালবাসা পুতুল খেলা আর নারে আর না।।"
Khan Ataur Rahaman,আমাকে পোড়াতে যদি এতো লাগে ভালো,"আমাকে পোড়াতে যদি এতো লাগে ভালো

জ্বালো আগুন আরো জ্বালো, ঢালো আরো ব্যথা ঢালো

আমাকে পোড়াতে যদি এতো লাগে ভালো।।

আমি তো পুড়ে পুড়ে অঙ্গার হয়েছি

দিয়েছো আঘাত যতো, সবই তার সয়েছি

নিঠুর ওগো, তবুও তোমাকে লেগেছে ভালো, তোমাকে বেসেছি ভালো

জ্বালো আগুন আরো জ্বালো, ঢালো আরো ব্যথা ঢালো

আমাকে পোড়াতে যদি এতো লাগে ভালো।।

এ হৃদয় ধূপসম তোমারি জ্বালায়

যাক যদি জ্বলে পুড়ে ছাই হয়ে যায়

কিছু তার সুরভি, কিছু তার বেদনা

পড়বে তোমার মনে, যেখানেই থাকো না।

সেদিনের সে স্মৃতি, জানি গো তোমার মনে জ্বালবে না আলো

জ্বালো আগুন আরো জ্বালো, ঢালো আরো ব্যথা ঢালো

আমাকে পোড়াতে যদি এতো লাগে ভালো।।"
Khan Ataur Rahaman,মায়ের মত আপন কেহ নাই,"মায়ের মত আপন কেহ নাই রে

মায়ের মত আপন কেহ নাই

মা জননী নাইরে যাহার

ত্রিভুবনে তাহার কেহই নাইরে।।

এই দুনিয়ায় নয়ন মেলে

মাগো তোমায় দেখেছি

তোমার বুকে হেসে খেলে

তোমার কথাই শিখেছি।

তাই তো বলি তোমার মত

মরমী কেউ নাই মাগো

তোমার মত আপন কেহ নাই রে

মায়ের মত আপন কেহ

আমি আঘাত পাইলে তোমার

চোখ নামে পানি

সেই পানিতে ধুয়ে মাগো

কোলেতে লও টানি।

তুমি যেদিন থাকবে না মা

সেদিন আমার হবে কি

সুখে থাকি দুঃখে থাকি

কাহার আসবে যাবে কি।

তাই তো বলি তোমার মত

দরদী কেউ নাই মাগো

তোমার মত আপন কেহ নাইরে

মায়ের মত আপন কেন নাই রে

মায়ের মত আপন কেন নাই।।"
Khan Ataur Rahaman,পাখিরে তুই দূরে থাকলে,"পাখিরে তুই খাঁচা ভেঙে আমার কাছে আয়

চোখের মনি চোখের কাছে না থাকলে

মনটা আমার আকূল হয়ে

মরে যেতে চায়

পাখিরে তুই দূরে থাকলে

কিছুই আমার ভালো লাগে না

পাখিরে তুই. . .

পাখিরে তুই কাছে থাকলে

গানের সুরে পরান দোলে

হৃদয় নাচে সুরের তালে

মনে মনে তোমায় ডাকি সারাবেলা

তা কি জানো না

যদি কোনদিন আমার পাখি

আমায় ফেলে উড়ে চলে যায়

একা একা রব নিরালায়

পাখিরে তুই কবে আমার

আপন হবি কিছুই জানি না"
Khan Ataur Rahaman,এ কী সোনার আলোয় জীবন ভরিয়ে দিলে,"একি সোনার আলোয়

জীবন ভরিয়ে দিলে।

ওগো বন্ধু কাছে থেকো কাছে থেকো।

রিক্ত আমার ক্ষুদ্র প্রাণে

তোমার আঁখিটি রেখো।।

আমি দিয়েছি আমার হৃদয় লুটিয়ে

তোমার প্রেমের জন্য

তুমি দু’হাত বাড়ায়ে বুকেতে জড়ায়ে

করেছো আমায় ধন্য।

বুকের পাঁজরে তেমনি লুকিয়ে রেখো

এমনি আমায় প্রাণের বাঁধনে

সোনার খাঁচাতে রেখো।।

জীবন হবে যে এতো সুন্দর

কখনো ভাবিনি আগে

এতো সুখ আর এতো আনন্দ

স্বপ্নের মতো লাগে।

ওগো যদি কোনোদিন জলছবি সম

মুছে যায় এই ছবি

আমি ঘুম ভেঙে দেখি স্বপ্নের মতো

হয়েছে বিফল সবই।

সেদিন বন্ধু আমার কথাটি রেখো

রাতের নিরলে আমার স্মৃতির

প্রদীপ জ্বালিয়ে রেখো।।"
Khan Ataur Rahaman,রংধনু চোখে চোখে,"রংধনু চোখে চোখে,কথা বলি মুখে মুখে।

এখানে মনের কথা বলো না।

কথা হবে মনে মনে, তুমি আমি নিরজনে

যেখানে দিগন্তে, আকাশ আর মাটিতে

দেখা হবে পৃথিবীর প্রান্তে।

সেখানেই হবে যত কথা

এখানে রঙের খেলা,

এখানে শখের মেলা

এখানে মনের কথা বলো না।

এখানে হিসাব গোনা দেনা আর পাওনা

এখানে দেখা হয় কি পেলাম কি দিলাম

সে হিসাব মেটাবার জন্যে।

এখানেই নেই কোন কথা

এখানে সবাই একা

এখানে চোখের দেখা

এখানে মনের কথা বলো না।"
Khan Ataur Rahaman,যদি আর দেখা নাই হয়,"যদি আর দেখা নাই হয়

ও গো বন্ধু মনে রেখো

অজীবন তোমারই রইবো।।

একদিন এই দেশ মুক্ত হবেই আমি জানি

হয়ত সেদিন ওগো তুমি আর ফিরবে না পরে

তোমার আশায় তবু দাঁড়িয়ে রইবো এই আমি

চিরদিন দাঁড়িয়ে থাকবো।।

যদি ফিরে এসে দেখ এ ভুবনে আমি আর নেই

স্মৃতির জানালা খুলে আকাশে তাকিয়ে দেখ বন্ধু

তাঁরার মালাটি গেথে দাঁড়িয়ে রয়েছি এই আমি

চিরকাল দাঁড়িয়ে থাকবো।।"
Khan Ataur Rahaman,আমি এক নীড়হারা ঝড়ের পাখি,"ঝড়ের পাখি আজানার পানে ছুটে চলেছি

এ পথের শেষ হবে কবে জানি না

পথ হারা পথ বেয়ে চলেছি

আমি এক নীড়হারা ঝড়ের পাখি

আজানার পানে ছুটে চলেছি

এ পথের শেষ হবে কবে জানি না

পথ হারা পথ বেয়ে চলেছি

ঝড় যদি বলে দিত কি যে আছে কি যে হবে

এ পথের শেষ প্রান্তে।

জীবনের দ্বিধাটুকু মিটিয়ে দিতেম

আমি সাগরের অতলান্তে

ঝড় শুধু হাসে তার খেয়ালের হাসি।

জীবনের প্রেম তাই ***

আমি এক নীড়হারা ঝড়ের পাখি

তোমরা নীড়ের পাখি নীড়হারা জীবনের

ব্যাথাটুকু যদি জানতে।

অচেনা আমার নামে হৃদয়ের অঞ্জলি

দুটি হাত ভরে আনতে

মান কি বা নাই মান তোমাদের খুশি।

আমার কথাটি আমি বলেছি

আমি এক নীড়হারা ঝড়ের পাখি

আজানার পানে ছুটে চলেছি

এ পথের শেষ হবে কবে জানি না

পথ হারা পথ বেয়ে চলেছি।"
Khan Ataur Rahaman,তোমার আগুনে পোড়ানো এ দুটি চোখে,"তোমার আগুনে পোড়ানো এ দুটি চোখে

একই তৃষ্ণা একই ক্লান্তি শুধু তুমি নাই বলে।

ওগো পোড়ানো এ দুটি হাতে

আজো জ্বলছে কিছু স্বপ্ন কবে আসবে বলে

একই তৃষ্ণা একই ক্লান্তি শুধু তুমি নাই বলে।।

ও হায় এরচেয়ে আমি আগেই ছিলেম ভাল

তুমি ছিলে না আলো ছিলে না

ও গো আমার ভুবন কালো ছিল এখনো

থাকতো কালো তুমি এলে আলো দিলে

তুমি নাই আলো নাই।।

তুমি যখন ছিলে এ দুটি নয়ন ভরে

এই নিরালা পৃথিবীতে

কত সোনার হাসি ছড়িয়ে দিতেম তোমার মতন করে

তুমি ছিলে সবই ছিল তুমি না কিছু নাই।।"
Khan Ataur Rahaman,মন মাঝি তোর বৈঠা নে রে,"মন মাঝি তোর বৈঠা নে রে

আমি আর বাইতে পারলাম না।

সারা জনম উজান বাইলা

ভাটির নাগাল পাইলাম না

আমি আর বাইতে পারলাম না।।

দুখের দেশে দুঃখের নদী

কাইন্দা বইয়া যায়

সুখের আশার মন মাঝি তুই

কান্দস আরে হায়।

মন মাঝি তুই বেভুল যেমন

আমি কপাল পুরা তেমন।

সুখ দুখের কিনার পাইলাম না

আমি আর বাইতে পারলাম না।"
Khan Ataur Rahaman,আগুন জ্বলেরে নিভানের মানুষ নাই,"আগুন জ্বলেরে নিভানের মানুষ নাই

কাইজ্যার বেলা আছে মানুষ

মিলের বেলা নাই মনের আগুন জ্বলে রে।।

জ্বালাইলে যে জ্বলে আগুন নিভানো যে দায়

ভাঙ্গা চূড়া সহজ কথা গড়া বড় দায়।

সারা জনম দুঃখ সইয়া বান্ধিলাম যে ঘর

কী জানি কী দোষে সে ঘর পুইড়া হইলো ছাই

মনের আগুন জ্বলে রে

নিজেরে পোড়াইয়া পিদিম আন্ধার ঘুচায়

কাঁটার ব্যাথা দুখেরে ফুল সুগন্ধ বিলায়।

দুখের পাহাড় বুকে লইয়া হাসি মুখে রয়

এমন সোনার মানুষ হায়রে কোথায় খুইজা পাই

মনের আগুন জ্বলে রে।।"
Khan Ataur Rahaman,এক নদী রক্ত পেড়িয়ে,"এক নদী রক্ত পেড়িয়ে

বংলার আকাশে রক্তিম সূর্য আনলে যারা

তোমাদের এই ঋণ কোনদিন শোধ হবে না

না না না শোধ হবে না

মৃত্যুর মুখোমুখি দাড়িয়ে

সাত কোটি মানুষের জীবনের সন্ধান আনলে যারা

সে গানের মহিমা কোন দিন ম্লান হবে না

না না না ম্লান হবে না

হয়তবা ইতিহাসে তোমাদের নাম লেখা রবে না

বড় বড় লোকেদের ভীড়ে জ্ঞানী আর গুনিদের আসরে

তোমাদের কথা কেউ কবে না

তবু এই বিজয়ী বীর মুক্তিসেনা

তোমাদের এই ঋণ কোন ঋণ কোন দিন শোধ হবে না

না না শোধ হবে না

থাক ওরা পরে থাক ইতিহাস নিয়ে

জীবনের দীনতা হীনতা নিয়ে।

তোমাদের কথা রবে সাধারণ মানুষের ভীড়ে

মাঠে মাঠে কৃষাণের মুখে, ঘরে ঘরে কৃষাণীর বুকে

স্মৃতি বেদনার আখি নীড়ে

তবু এই বিজয়ী বীর মুক্তি সেনা

তোমাদের এই ঋণ কোনদিন শোধ হবে না

না না না শোধ হবে না"
Khan Ataur Rahaman,মন যদি ভেঙে যায়,"মন যদি ভেঙে যায়

যাক, যাক, কিছু বলব না।

তোমার যাবার বেলা

আমার প্রেমের কথা তুলব না।।

নাইবা মানলো বাধা

চোখের জলের এই নদী

পথ চেয়ে একা একা

কাঁদব না হায় নিরবধি।

তোমার পথের জ্বালা

তোমার পায়ের ধুলা।

মুছিয়ে দিয়েছি আঁখি জলে

সেই তো অনেক বড় সান্ত্বনা।।

কি আছে না হয় আমি

কেঁদেই কাটাব এ জীবন

না হয় ছলনা দিয়ে

বুঝিয়ে রাখব এ মন।

তোমার জীবন তৃষা

পেয়েছে পথের দিশা।

এগিয়ে চলেছ সে পথে

সেই তো অনেক বড় সান্ত্বনা।।"
Khan Ataur Rahaman,যারে যাবি যদি যা,"যারে যাবি যদি যা

পিঞ্জর খুলে দিয়েছি

যা কিছু কথা ছিল

ভুলে গিয়েছি।।

যারে বাঁধন কেঁটে যা

যারে হৃদয় ভেঙ্গে যা।

শুনেছি খাঁচার পাখি

আপন হবার নয়

জানি রে জানি তোকে

ভালোবাসা ভালো নয়।

যারে আকাশে উড়ে যা

যারে পথ ভুলে যা

জানি রে এ জীবনে

তোকে পাবার নয়।

আকাশের ঠিকানা

খুঁজে পাবার কথা নয়।।"
