Writer,Title,Song
Liton Odhikari Rintu,"যারে ঘর দিলা সংসার দিলা রে, তারে বৈরাগী মন কেন দিলা রে","যারে ঘর দিলা সংসার দিলা রে।।

তারে বৈরাগী মন কেন দিলা রে।।

যে অন্তরে ভালোবাসা স্বপন জীবন ভর

সে অন্তরে কত জ্বালা কত ঘৃণা পর।।

যারে নয়ন দিলা…….

যারে নয়ন দিলা আলো দেখিতে।।

গুরু, আঁধার জীবন কেন দাও তারে।।

নিজের হাতে নিজের মতে গড়ো এ ভূবন

সে ভূবনে ওলট পালট হয় কেন এমন ?

যারে জীবন দিলা …….

যারে জীবন দিলা জীবন গড়িতে।।

তারে, মরার আগে মারো কেন রে।।"
Liton Odhikari Rintu,কিছুই নাকি দেইনি তোমায়,"কিছুই নাকি দেইনি তোমায়

বলো কে করেছে নিঃস্ব আমায়।

প্রেমেরই এক বৃন্দাবনে ছিলাম রাজা

তুমি ছিলে প্রেমে উদাস দুঃখিনি এক প্রজা

তোমায় সুখে রাখতে গিয়ে

খাজনাবিহীন থাকতে দিয়ে

রাজ্য গেল হায়।।

রাজকোষে জমা করে রেখেছি যা আমি

রাখিনি কিছুই যে তার দিয়েছি তো সবই

তোমার ঘরে আলো দিতে

প্রাসাদ আমার সেদিন থেকে

আঁধার হলো হায়।।"
Liton Odhikari Rintu,আমি তোরই সাথে ভাসতে পারি,"আমি তোরই সাথে ভাসতে পারি

মরণ খেয়ায় একসাথে

যদি পরাণটারে রাখিস ডেকে

তোর পরাণের ছায়াতে।।

পুড়তে পারি তুষের মত তোর প্রেমেরই আগুনে

উড়তে পারি ছাইয়ের মত তোর প্রেমের কারণে

যদি পরাণটারে রাখিস ডেকে

তোর পরাণের ছায়াতে।।

রইতে পারি বন্দি হয়ে যন্ত্রনারই প্রাচিরে

দিতে পারি বিষের থালা নিমেষে উজার করে

যদি পরাণটারে রাখিস ডেকে

তোর পরাণের ছায়াতে।।"
Liton Odhikari Rintu,তুমি ছাড়া আমি যেন মরুভূমি,"তুমি ছাড়া আমি যেন মরুভূমি

পথ হার পথিকের মত

ও সাজানো পৃথিবী এলোমেলো হয়ে যায়

থাকে না আগেরই মত।। (ও)

প্রাণহীন দেহ নিয়ে মনে হয় আছি পড়ে

আধারের বনবাসে আমি।

স্বপ্ন মহল ভেঙে ধুলোতে মিলায়

থাকে না আগেরই মত।। (ও)

বেদনার বালুচরে গতিহীন হয়ে পড়ে

জীবন নদীর স্রোতধারা।

পাতার মত সুখ ঝরে পড়ে হায়

থাকে না আগেরই মত।। (ও)"
