Writer,Title,Song
Songroho,আমি যারে ভালবাসি,"আমি যারে ভালবাসি

তারে আবার বাসি না

কেন তারে ভাল লাগে না

আমি যারে ভালবাসি ।

ঘুরলাম কত বৈদেশ বন্দর

পাইলাম না তো একটা অন্তর

যা দেখি তাই হাওয়ায় মিঠাই

আসলের আসল কিছু নাই ।

ঘরের মায়ায় টানে মোরে

বাহিরেও যে ছাড়ে নারে

রঙ্গিলা দো-টানায় পইড়া

সন্নাসী হইতেও আমি পারলাম ।"
Songroho,ও মোর বানিয়া বন্ধু রে,"ও মোর বানিয়া বন্ধু রে

একটা তাবিজ বানাইয়া দে।

একটা মাদুলি বানাইয়া দে।

ওরে মরিয়া গিয়াছে

বিয়ার সোয়ামী স্বপনে আইসে।।

যে জন সোনার বানিয়া

নীতি করে সোনাকো না মোর

ওজন করিয়া দেয়।

ও মোর সাধের বানিয়া রে

ও মোর ভাবের বানিয়া রে

ওরে সোনা-রূপা মিশিল করে একটা

তাবিজ বানাইয়া দে।

ওরে মরিয়া গিয়াছে

বিয়ার সোয়ামী স্বপনে আইসে।।

হাতের নিলুক মোর কোচার নিল

হাকার রুমুক নিভুয়াতে

যাক মারিল লোকের কথাতে।

ও মোর ভাবের বানিয়া রে

ও মোর সাধের বানিয়া রে

ওরে দিবার চাইয়া নাকের

নোলক নাই দিলু মোরে।

ওরে মরিয়া গিয়াছে

বিয়ার সোয়ামী স্বপনে আইসে।।"
Songroho,কানার হাট বাজার,"গুরু গো.. ও ও ও …

বেধ বিধির পথ শাস্ত্র কানা

আর এক কানা মন আমার

এসব দেখি কানার হাট বাজার

এক কানা কয় আর এক কান।রে

চল এবার ভব পারে।।

নিজে কানা

পথ চেনে না

পরকে ডাকে বারং বার

এসব দেখি কানার হাট বাজার

পন্ডিত কানা অহংকারে

সাধু কানা অন্-বিচারে

পন্ডিত কানা অহংকারে

মোড়ল কানা চুগলখোরে

আন্দাজে এক খুটি গেরে।।

জানেনা সীমানা কার

এসব দেখি কানার হাট বাজার।।

কানায় কানায় হোলা মেলায়

বোবাতে খায় রস গোল্লা গো

আবার লালন বলে মদনা কানা

ঘুমের ঘোরে দেয় বাহার

এসব দেখি কানার হাটবাজার"
Songroho,নিথুয়া পাথারে,"নিথুয়া পাথারে নেমেছি বন্ধুরে

ধর বন্ধু আমার কেহ নাই

তোল বন্ধু আমার কেহ নাই।।

চিকন ধুতিখানি পড়িতে না জানি

না জানি বান্ধিতে কেশ।

অল্প বয়সে পীরিতি করিয়া

হয়ে গেল জীবনেরও শেষ।

প্রেমেরও মুরলি বাজাতে নাহি জানি

না পারি বান্ধিতে সুর।।

নিথুয়া পাথারে নেমেছি বন্ধুরে

ধর বন্ধু আমার কেহ নাই

তোল বন্ধু আমার কেহ নাই।।"
