Writer,Title,Song,syn_prompt
Sejan Mahmud,কোন এক সুন্দরী রাতে,"কোন এক সুন্দরী রাতে

রঙ্গিন খামে লেখা তোমার চিঠির মত চাঁদ

জোছনায় সাজিয়ে ছিল আমার প্রহর

আমি নিঃঘুম সেই রাত হয়েছিল ভোর।।

জোনাকীরা দূর বনে আলো আধারেতে

বিষন্ন আলো জ্বেলে জেগেছিল সাথে।

তুমি ছিলে না সেই দুঃখ যেন

দিয়ে গেছে আজানা দূরের খবর

নিঃঘুম সেই রাত হয়েছিল ভোর

ঘর ছাড়া মন যেন ময়ূরী পাখায়

নিঃসঙ্গ ভেসে চলে দূর অজানায়।

তুমি এলে না তাই *** বাঁশী

নিয়ে গেছে সাজানো সুখের ***।।","ঠিক আছে, এই গানের জন্য একটা সৃজনশীল প্রম্পট নিচে দেওয়া হল:

**গান: কোন এক সুন্দরী রাতে**

**বিষয়:** একটি বিরহের গান, যেখানে প্রকৃতির সৌন্দর্য এবং প্রিয়জনের অনুপস্থিতি একাকার হয়ে গেছে।

**প্রম্পট:**

মনে করো, তুমি একজন যাযাবর বাউল। তুমি বহু বছর ধরে গ্রাম থেকে গ্রামান্তরে ঘুরে বেড়াও, গান গেয়ে বেড়াও। এক রাতে, তুমি একটি নদীর ধারে এসে বিশ্রাম নিচ্ছো। আকাশ ভরা পূর্ণিমা চাঁদ। চারপাশের প্রকৃতি অপরূপ শান্ত, কিন্তু তোমার মন বিষাদে ভরা। বহু বছর আগে তুমি একজনকে ভালোবেসেছিলে, কিন্তু সময়ের স্রোতে সে হারিয়ে গেছে। আজ এই রাতে, চাঁদের আলোয় তার কথা খুব মনে পড়ছে। সেই স্মৃতি, সেই হারিয়ে যাওয়া প্রেম যেন প্রকৃতির সাথে মিশে একাকার হয়ে গেছে। তোমার মনে হচ্ছে, যেন চাঁদটা তার চিঠির মতো, জোনাকিরা তার বিরহের সাক্ষী আর বাঁশি যেন তার ভালোবাসার সুর চুরি করে নিয়ে গেছে।

**এই প্রম্পট ব্যবহার করে নিম্নলিখিত বিষয়গুলো নিয়ে ভাবো এবং গানের বাকি অংশ লেখো:**

*   চাঁদের আলো তোমার মনে কী ধরনের অনুভূতি জাগাচ্ছে? কী কী স্মৃতি ভেসে উঠছে?
*   জোনাকি পোকাদের আলো-আঁধারি খেলা কি তোমার একাকিত্বকে আরও বাড়িয়ে দিচ্ছে?
*   বাঁশি তোমার কাছ থেকে কী কেড়ে নিয়েছে? সেটা কি শুধু সুখ, নাকি আরও কিছু?
*   ""ঘর ছাড়া মন যেন ময়ূরী পাখায়"" - এই লাইনটি দিয়ে তুমি কী বোঝাতে চেয়েছো? কোথায় ভেসে যেতে চাইছে তোমার মন?
*   গানের শেষে, তোমার মনের অবস্থা কেমন? তুমি কি কোনো আশা রাখো, নাকি পুরোপুরি হতাশ?

**অতিরিক্ত কিছু আইডিয়া:**

*   গানে কিছু রূপক ব্যবহার করো (যেমন, চাঁদ = চিঠি, জোনাকি = বিরহের সাক্ষী, বাঁশি = সুখ হরণকারী)।
*   প্রকৃতির বিভিন্ন উপাদান (নদী, বাতাস, পাখি) ব্যবহার করে তোমার মনের ভাব প্রকাশ করো।
*   গানের সুর বাউল ঘরানার সঙ্গে মানানসই করার চেষ্টা করো।

এই প্রম্পট এবং আইডিয়াগুলো তোমাকে ""কোন এক সুন্দরী রাতে"" গানটিকে আরও গভীর এবং আবেগপূর্ণ করে তুলতে সাহায্য করবে। শুভকামনা!
"
Sejan Mahmud,আমার দুচোখ দিয়ে তোমাকে যত আমি দেখি,"আমার দুচোখ দিয়ে

তোমাকে যত আমি দেখি

তার চেয়ে অনেক বেশী দেখি

যখন তোমায় দেখি না।।

আমার দুহাতে তোমাকে যতটুকু কাছে টানি

তার চেয়ে অনেক ছুয়ে যাই

যখন তোমায় কাছে পাই না।।

দূরের আকাশে মেঘেরই ছায়ায় তুমি

সেই তো তোমায় সীমান্ত

তোমার কাছে যেতে চাইনি

বলেই তো পাহাড়ি পথ অনন্ত

এর চেয়ে অধিক ***

তাই তো কাছে যেতে চাই না।।

রাতের গভীরে নির্জনতায় তুমি

এই তো তোমার দিগন্ত

বিরহ বিষাদেও রয়েছে সুখের সুর

সেই তো আমার বসন্ত

এই চেয়ে অধিক সুখনীল

তাই তো দুখের গান গাই আজ।","ধন্যবাদ! এই গানটির কাঠামো বেশ সুন্দর এবং আবেগঘন। এটিকে আরও সমৃদ্ধ করার জন্য, আমি নিম্নলিখিত সৃজনশীল প্রম্পটগুলি প্রস্তাব করছি:

**মূল সুর এবং প্রেক্ষাপট:**

*   গানটির মূল সুর বিরহ এবং না পাওয়ার বেদনা। এই বেদনাকে আরও গভীর করার জন্য, এমন একটি পরিস্থিতির কথা ভাবুন যেখানে নায়ক/নায়িকা একটি বিশেষ কারণে তার ভালোবাসার মানুষটির কাছে যেতে পারছে না। কারণটি হতে পারে সামাজিক বাধা, দূরত্ব, অথবা নিজের ভেতরের কোনো দুর্বলতা। এই কারণটি গানের তৃতীয় স্তবকে (""এর চেয়ে অধিক ***"") বিশেষভাবে ফুটিয়ে তুলতে হবে।

**শব্দ এবং উপমা:**

*   গানটিতে ""দূরের আকাশে মেঘেরই ছায়ায় তুমি"", ""পাহাড়ি পথ অনন্ত"", ""রাতের গভীরে নির্জনতায় তুমি"" - এই ধরনের কিছু সুন্দর চিত্রকল্প ব্যবহার করা হয়েছে। এই চিত্রকল্পগুলিকে আরও শক্তিশালী করার জন্য, প্রকৃতির আরও নতুন উপমা ব্যবহার করুন। যেমন, নদীর স্রোত, পাখির উড়াল, ঝরাপাতা, অথবা চাঁদের আলো - এই বিষয়গুলি ব্যবহার করে বিরহের অনুভূতিকে আরও গভীর করা যেতে পারে।

**তৃতীয় স্তবকের শূন্যস্থান পূরণ:**

*   ""এর চেয়ে অধিক ***"" - এই অংশে এমন একটি শব্দ বা শব্দগুচ্ছ বসাতে হবে যা গানটির মূল সুরের সাথে সঙ্গতিপূর্ণ হয় এবং নায়কের/নায়িকার দূরে থাকার কারণটিকে স্পষ্ট করে। কিছু সম্ভাব্য বিকল্প:
    *   ""এর চেয়ে অধিক অসহায়""
    *   ""এর চেয়ে অধিক প্রয়োজন"" (যেমন, অন্য কারো প্রতি দায়িত্ব)
    *   ""এর চেয়ে অধিক ভয়"" (হারানোর ভয়, প্রত্যাখ্যাত হওয়ার ভয়)
    *   ""এর চেয়ে অধিক মূল্যবান"" (যেমন, নিজের আদর্শ বা স্বপ্ন)
    এই শব্দবন্ধটি এমন হওয়া উচিত যা শ্রোতাদের মনে একটি গভীর দাগ কাটে এবং গানটিকে আরও স্মরণীয় করে তোলে।

**চতুর্থ স্তবকের বিস্তার:**

*   শেষ স্তবকে ""বিরহ বিষাদেও রয়েছে সুখের সুর, সেই তো আমার বসন্ত"" - এই লাইনটি একটি দ্বন্দ্ব তৈরি করে। এই দ্বন্দ্বকে আরও শক্তিশালী করার জন্য, বিরহের মধ্যে লুকানো সুখের অনুভূতিকে আরও বিশদে বর্ণনা করুন। কী কারণে বিরহ সত্ত্বেও বসন্তের আগমন ঘটে, তা ব্যাখ্যা করুন। যেমন, স্মৃতি, স্বপ্ন, অথবা ভালোবাসার মানুষটির মঙ্গল কামনা - এই বিষয়গুলি উল্লেখ করা যেতে পারে।

**ভাষা এবং ছন্দ:**

*   পুরো গানটিতে একটি কাব্যিক ভাষা ব্যবহার করা হয়েছে। এই ভাষাকে আরও সুরেলা করার জন্য, অন্ত্যমিল এবং অনুপ্রাসের ব্যবহার আরও বাড়ানো যেতে পারে। এছাড়াও, গানের ছন্দকে সাবলীল রাখার জন্য, শব্দচয়ন এবং বাক্যগঠনের দিকে বিশেষ মনোযোগ দিতে হবে।

**কিছু অতিরিক্ত আইডিয়া:**

*   গানটিতে একটি গল্প বলার চেষ্টা করুন। নায়ক/নায়িকা এবং তার ভালোবাসার মানুষটির মধ্যেকার সম্পর্কটি কেমন, তাদের জীবনে কী ঘটেছিল, কেন তারা দূরে আছে - এই বিষয়গুলি গানের মধ্যে অল্প অল্প করে তুলে ধরুন।
*   গানের শেষে একটি প্রশ্ন বা একটি খোলা বার্তা রাখতে পারেন, যা শ্রোতাদের নিজেদের জীবনের অভিজ্ঞতা নিয়ে ভাবতে বাধ্য করবে।

এই প্রম্পটগুলি ব্যবহার করে, আপনি আপনার গানটিকে আরও গভীর, আবেগঘন এবং স্মরণীয় করে তুলতে পারবেন। শুভকামনা!
"
